pair	inflected_pair	alignments	Source Language	Target Language
('tackle', 'issue')	('tackle', 'issue')	[('issue', 'question'), ('have', 'aurons'), ('to', 'à'),('tackle', 'régler')]	As you have listened to the opinions here , you will agree with me that the most difficult issue we have to tackle is the issue of admissibility - how we can find a solution which would avoid the frustration of citizens , how we can protect EU values , and how we can keep this institute of the European Citizens ' Initiative serious and real .	Si vous avez écouté les avis exprimés ici , vous serez d' accord avec moi pour dire que la question la plus difficile que nous aurons à régler est celle de la recevabilité - comment trouver une solution qui évitera de décevoir les citoyens , comment protéger les valeurs de l' UE et comment faire pour que cette initiative citoyenne européenne reste sérieuse et réelle ?
('tackle', 'issue')	('tackling', 'issue')	[('tackling', 'résolution'), ('tackling', 'de'), ('issue', 'problématique')]	I voted in favour of this motion for a resolution , because we must ensure that both practical and moral priority be given to tackling the issue of human trafficking and the way in which this trafficking is used as a resource in the labour market .	J' ai voté pour cette proposition de résolution parce que nous devons veiller à ce que la priorité pratique et morale soit accordée à la résolution de la problématique de la traite des êtres humains et à la manière dont cette traite est utilisée comme ressource sur le marché du travail .
('tackle', 'issue')	('tackle', 'issues')	[('tackle', 'aborder'), ('issues', 'problèmes')]	I would like to tackle some of the issues that were raised , in the couple of minutes I have been afforded .	J' aimerais profiter des quelques minutes qui m' ont été accordées pour aborder certains des problèmes soulevés lors de ce débat .
('tackle', 'issue')	('tackle', 'issue')	[('tackle', 'répondre'), ('tackle', 'à'), ('issue', 'problème')]	What plans does the Presidency have to tackle this issue ?	Quelles mesures la Présidence entend -elle prendre en vue de répondre à ce problème ?
('tackle', 'issue')	('tackling', 'issue')	[('is', 'aborde'), ('tackling', 'aborde'), ('issue', 'question')]	The fifth question related to how the Commission is tackling the MIF issue for card payments .	La cinquième question est liée à la façon dont la Commission aborde la question des commissions d' interchange pour les paiements par carte .
('tackle', 'issue')	('tackled', 'issues')	[('issues', 'problèmes'), ('were', 'se'), ('were', 'soit'), ('tackled', 'attaquée'), ('tackled', 'à')]	Firstly , I would applaud the fact that at the G20 meeting , such important issues were tackled as sustainable economic growth , employment and potential climate change phenomena , which could threaten the habitability of our planet .	Tout d' abord , je me réjouis que la rencontre du G 20 se soit attaquée à des problèmes aussi importants que la croissance économique durable , l' emploi et les effets potentiels du changement climatique , qui menacent de rendre notre planète inhabitable .
('tackle', 'issue')	('tackle', 'issues')	[('tackle', 'faire'), ('tackle', 'face'), ('tackle', 'à'), ('issues', 'problèmes')]	But before we have a true Community method to tackle these issues , we at least expect Member States to cooperate well among themselves .	Mais jusqu'à ce que nous ayons une véritable méthode communautaire en vue de faire face à ces problèmes , nous espérons au moins des États membres qu' ils coopèrent les uns avec les autres .
('tackle', 'issue')	('tackle', 'issues')	[('tackle', 'aborder'), ('issues', 'questions')]	Our strategic partnership is strong , and this permits us to tackle all issues , including the most sensitive ones .	Notre partenariat stratégique est solide et nous permet d' aborder toutes les questions , en ce compris les plus sensibles .
('tackle', 'issue')	('tackle', 'issues')	[('tackle', 'résolution'), ('tackle', 'de'), ('issues', 'problèmes')]	It seems that there is a lack of political will on an EU level to provide adequate resources to tackle these issues in a fair manner .	Il ne semble pas y avoir de volonté politique suffisante à l' échelon européen pour fournir des ressources adéquates à la résolution de ces problèmes d' une manière équitable .
('tackle', 'issue')	('tackle', 'issues')	[('tackle', 'faire'), ('tackle', 'face'), ('tackle', 'aux'), ('issues', 'problèmes')]	It is only by unlocking people 's imaginations that we can tackle the major issues facing us today , such as climate change , social exclusion , demographic change and unemployment .	C' est uniquement en libérant l' imagination des gens que nous pourrons faire face aux problèmes majeurs auxquels nous sommes confrontés aujourd'hui , tels que le changement climatique , l' exclusion sociale , le changement démographique et le chômage .
('tackle', 'issue')	('tackle', 'issues')	[('tackle', 'régler'), ('issues', 'questions')]	In particular , if it is to contribute effectively to the development of a single , competitive , energy market , the Agency needs more powers to tackle cross-border issues and encourage effective cooperation between transmission system operators ( TSOs ) and national regulatory authorities ( NRAs ) .	En outre , si nous souhaitons contribuer de manière efficace au développement d' un marché de l' énergie unique et compétitif , il semble évident que l' Agence devra disposer de davantage de pouvoirs afin de régler les questions transfrontalières et d' encourager la coopération efficace entre les gestionnaires de réseau de transport ( GRT ) et les autorités réglementaires nationales ( ARN ) .
('tackle', 'issue')	('tackled', 'issues')	[('issues', 'questions'), ('to', 'à'), ('be', 'à'), ('tackled', 'aborder')]	The priority issues to be tackled in the review are , therefore , the harmonisation and extension of the scope of the directive , further harmonisation and more predictability of the cap-setting and allocation process -- including consideration of competitiveness , more robust compliance and enforcement of the rules and the linking to trading schemes in third countries and increased involvement of developing countries .	Les questions prioritaires à aborder dans la révision sont donc l' harmonisation et l' extension du champ d' application de la directive , la poursuite de l' harmonisation et le renforcement de la prévisibilité du processus de fixation des plafonds et d' allocation , prenant en considération notamment la compétitivité , un respect et une application plus solides des règles et du lien avec les systèmes d' échange dans les pays tiers , ainsi qu' une implication accrue des pays en développement .
('tackle', 'issue')	('tackling', 'issue')	[('tackling', 'règlera'), ('issue', 'question')]	We must ensure that any EU directive tackling this issue contains no loopholes and that it is satisfactorily implemented in all member states .	Nous devrons veiller à que la directive européenne qui règlera cette question ne contienne pas d' échappatoire et à ce qu' elle soit appliquée correctement dans tous les États membres .
('tackle', 'issue')	('tackle', 'issue')	[('tackle', 'enrayer'), ('issue', 'problème')]	It is true , as you rightly pointed out , that China is still a major source of counterfeited cigarettes , so we have to work in close cooperation with them in order to tackle this issue .	Il est vrai , comme vous l' avez remarqué , que la Chine est la principale source de cigarettes de contrefaçon , nous devons donc travailler en étroite coopération avec elle afin d' enrayer ce problème .
('tackle', 'issue')	('tackled', 'issues')	[('issues', 'questions'), ('can', 'peuvent'), ('be', 'être'), ('tackled', 'réglées')]	There is also an instinctive sense that these issues can only be tackled effectively at European level .	Il existe également le sentiment instinctif que ces questions ne peuvent être réglées de manière efficace qu' au niveau européen .
('tackle', 'issue')	('tackling', 'issues')	[('tackling', 'régler'), ('issues', 'problèmes')]	It is for that reason that the Commission has suggested that the participation in the human rights consultations should be widened to include not only diplomats but also experts from line ministries and agencies responsible for tackling these issues on the ground .	C' est pour cette raison que la Commission a suggéré que la participation aux consultations sur les droits de l' homme soit élargie afin d' y inclure non seulement les diplomates mais aussi les experts des ministères concernés et des agences chargées de régler ces problèmes sur le terrain .
('tackle', 'issue')	('tackled', 'issues')	[('issues', 'questions'), ('to', 'à'), ('be', 'à'), ('tackled', 'traiter')]	The request for the Commission to draw up an action plan to define the issues to be tackled deserves careful consideration .	Le souhait de voir la Commission élaborer un plan d' action en vue de déterminer les questions à traiter mérite d' être étudié attentivement .
('tackle', 'issue')	('tackle', 'issue')	[('tackle', 'enrayer'), ('issue', 'problème')]	Does the Commission have any plans to enable , or indeed force , Member States to increase their checks at external EU borders , in order to tackle the issue of customs fraud ?	La Commission a-t -elle élaboré un plan pour permettre aux États membres d' intensifier les contrôles aux frontières extérieures de l' Union européenne , voire les y forcer , afin d' enrayer le problème de la fraude douanière ?
('tackle', 'issue')	('tackle', 'issues')	[('tackle', 'aborder'), ('issues', 'questions')]	Our strategic partnership is strong , which permits us to tackle all issues , including the most sensitive ones .	Notre partenariat stratégique est solide , ce qui nous permet d' aborder toutes les questions , y compris les plus délicates .
('tackle', 'issue')	('tackling', 'issue')	[('tackling', 'résolution'), ('tackling', 'de'), ('issue', 'question')]	Within the framework of its legislative proposal , the Commission will therefore include a biofuel sustainability scheme designed to ensure that the biofuel sector plays its part in tackling this issue .	Dans le cadre de sa proposition de législation , la Commission inclura dès lors un programme de durabilité des biocarburants , pour veiller à ce que le secteur des biocarburants joue son rôle dans la résolution de cette question .
('tackle', 'issue')	('tackle', 'issues')	[('tackle', 'aborder'), ('issues', 'sujets')]	Having such a strong strategic partnership would and does definitely permit us to tackle all issues , including the most sensitive ones .	Ce solide partenariat stratégique devrait nous permettre , et nous permet sans aucun doute , d' aborder tous les sujets , même les plus sensibles .
('tackle', 'issue')	('tackling', 'issue')	[('tackling', 'résolution'), ('tackling', 'de'), ('issue', 'problème')]	But I agree that we need to be tackling this issue all the time , coming up with proposals and looking for new openings , because global trade will definitely benefit the global economy and this is what most of the world economy needs at this moment .	J' admets toutefois que la résolution de ce problème nécessite une action permanente , que nous devons sans cesse formuler de nouvelles propositions et chercher de nouvelles ouvertures , car il est certain que les échanges internationaux profiteront à l' économie mondiale ; et c' est ce dont a besoin la majeure partie de celle-ci en ce moment .
('tackle', 'issue')	('tackling', 'issue')	[('will', 'aborderont'), ('be', 'aborderont'), ('tackling', 'aborderont'), ('issue', 'question')]	The meeting due to take place in Gaza tomorrow between President Abbas and Prime Minister Olmert has unfortunately been cancelled , but at least the leaders of the G8 will tomorrow be tackling the issue of the Palestine-Israeli conflict , as we did at the G8 Foreign Ministers ' meeting .	La réunion prévue à Gaza demain entre le président Abbas et le Premier ministre Olmert a malheureusement été annulée , mais , au moins , les dirigeants du G 8 aborderont demain la question du conflit israélo-palestinien , comme nous l' avons fait à l' occasion de la réunion des ministres des affaires étrangères du G 8 .
('tackle', 'issue')	('tackled', 'issues')	[('issues', 'questions'), ('will', 'seront'), ('be', 'seront'), ('tackled', 'résolues')]	There are different systems in different Member States so we do not always agree on a common approach , but at least the first step will be taken and many issues like information for patients and other aspects of patients ' rights will be tackled through the healthcare initiative .	Il existe divers systèmes dans les différents États membres et nous n' arrivons pas toujours à tomber d' accord sur une approche commune , mais au moins le premier pas sera fait et de nombreuses questions , comme celles concernant l' information des patients et d' autres aspects des droits des patients , seront résolues dans le cadre de l' initiative concernant les soins de santé .
('tackle', 'issue')	('tackling', 'issues')	[('tackling', 'traitement'), ('tackling', 'de'), ('issues', 'sujets')]	The Article 185 initiatives are playing a key role in tackling some of these key issues .	Les initiatives de l' article 185 jouent un rôle prépondérant dans le traitement de ces sujets clés .
('tackle', 'issue')	('tackling', 'issue')	"[('tackling', ""s'""), ('tackling', 'attaquer'), ('tackling', 'à'), ('issue', 'problème')]"	This package represents an opportunity for Europe to show itself at its best : tackling an issue of fundamental long-term importance ; using the European Union 's continental scale to best effect ; turning political consensus into practical action .	Ce paquet représente une opportunité pour l' Europe pour se montrer sous son meilleur angle : s' attaquer à un problème d' importance fondamentale à long terme ; utiliser au mieux la dimension continentale de l' Union européenne ; transformer le consensus politique en mesures concrètes .
('tackle', 'issue')	('tackle', 'issue')	[('issue', 'point'), ('tackle', 'aborder')]	The third issue I wanted to tackle is China .	Le troisième point que je voulais aborder est le cas de la Chine .
('tackle', 'issue')	('tackle', 'issue')	[('tackle', 'faire'),('tackle', 'face'),('tackle', 'à'), ('issue', 'question')]	It is very important to tackle the issue of immigration , to manage migratory flows when we achieve the understanding and the cooperation of the countries of origin and transit .	Il est très important de faire face à la question de l' immigration , de gérer les flux migratoires lorsque nous obtenons la compréhension et la coopération des pays d' origine et de transit .
('tackle', 'issue')	('tackle', 'issue')	[('tackle', 'répondre'), ('tackle', 'à'), ('issue', 'question')]	Research institutes and scientists are waiting for rapid , coordinated action from the Commission and Council in order to tackle this issue , so as to allow them equal opportunities for participation in Framework Programmes .	Les instituts de recherche et les scientifiques attendent une action rapide et coordonnée de la Commission et du Conseil pour répondre à cette question , de sorte à leur fournir des chances égales de participer aux programmes-cadres .
('tackle', 'issue')	('tackle', 'issue')	[('tackle', 'résoudre'), ('issue', 'problème')]	I strongly believe that the EMA should not only act as a shield for consumers in relation to information on medicines , but when consumers are being blatantly overcharged for medicines and national governments are unable to tackle the issue , the EMA should have the ability to address the issue .	Je crois fermement que l' AEM devrait non seulement servir à filtrer les informations sur les médicaments communiquées aux consommateurs , mais qu' elle devrait également pouvoir intervenir lorsque les consommateurs paient clairement trop cher pour des médicaments et que les gouvernements nationaux se montrent incapables de résoudre le problème .
('tackle', 'issue')	('tackled', 'issue')	[('issue', 'question'), ('be', 'soit'), ('tackled', 'traitée')]	I voted in favour of the motion for a resolution on safe recycling of ships as I feel that it is vital for this issue to be tackled as an integral part of a ship 's lifecycle .	par écrit . - ( PT ) J' ai voté en faveur de la proposition de résolution sur le recyclage sûr des navires , car je pense qu' il est essentiel que cette question soit traitée comme faisant partie intégrante du cycle de vie du navire .
('tackle', 'matter')	('tackle', 'matters')	[('tackle', 'aborder'), ('matters', 'préoccupations')]	Concerning political dialogue , these agreements will aim to tackle a wide range of matters , such as climate change , energy , migration and the fight against drugs .	Dans le domaine du dialogue politique , les accords s' efforceront d' aborder une large gamme de préoccupations , telles que le changement climatique , l' énergie , l' immigration et la lutte contre la drogue .
('tackle', 'matter')	('tackle', 'matter')	[('tackle', 'se'), ('tackle', 'saisir'), ('tackle', 'du'), ('matter', 'problème')]	Of course , it would be possible to arrive at such a very generous interpretation of the Treaty , to allow the EU to tackle the matter .	Il serait évidemment possible d' interpréter la directive avec générosité afin de permettre à l' UE de se saisir du problème .
('tackle', 'point')	('tackled', 'points')	[('points', 'aspects'), ('should', 'devraient'), ('be', 'être'),  ('tackled', 'abordés')]	Those specific points should be specifically tackled by the Commission .	Autant d' aspects spécifiques qui devraient être abordés par la Commission .
('tackle', 'point')	('tackle', 'point')	[('will', 'aborderons'), ('tackle', 'aborderons'), ('point', 'point')]	We will tackle that point if there is still any hesitation to be overcome .	Nous aborderons ce point s' il reste des hésitations à balayer .
('tackle', 'problem')	('tackling', 'problem')	[('tackling', 'attaquer'), ('problem', 'problème')]	It is essential that we in Parliament and the Commission , keep our minds , and our ears and our eyes open , for new ways of tackling the unemployment problem .	Il est essentiel qu' au Parlement et à la Commission , nous gardions nos esprits , nos oreilles et nos yeux ouverts aux nouveaux moyens d' attaquer le problème du chômage .
('tackle', 'problem')	('tackle', 'problem')	"[('tackle',""s'""),('tackle', 'attaquer'),('tackle', 'à'), ('problem', 'problème')]"	It is all too easy to import a problem , but it is very difficult to tackle a problem once it is within our borders .	Il est très facile d' importer un problème , mais il est extrêmement difficile de s' attaquer à un problème une fois qu' il se trouve à l' intérieur de nos frontières .
('tackle', 'problem')	('tackle', 'problems')	[('tackle', 'lutter'), ('tackle', 'contre'), ('problems', 'problèmes')]	The URBAN initiative will allow for projects to be undertaken in these areas to tackle the ingrained problems of long-term unemployment and urban decay .	Grâce à l' initiative URBAN , il sera possible de mener , dans les quartiers concernés , des projets conçus pour lutter contre les problèmes tenaces du chômage de longue durée et de la dégradation urbaine .
('tackle', 'problem')	('tackling', 'problem')	[('tackling', 'lutter'), ('tackling', 'contre'), ('problem', 'problème')]	Such marketing makes it increasingly difficult for parents to encourage healthy eating : limits on such marketing are therefore imperative in tackling this problem .	Une telle promotion complique de plus en plus pour les parents la défense d' une alimentation saine : des limites à ces promotions sont donc indispensables pour lutter contre ce problème .
('tackle', 'problem')	('tackled', 'problems')	[('problems', 'problèmes'), ('can', 'peuvent'),  ('be', 'être'), ('tackled', 'résolus')]	Many Members here are being invited , as I am , to conferences , some organized by presidents-in-office , full of experienced rational experts who want a European contribution to international problems which can not be properly tackled at local or national levels .	De nombreux députés sont , comme je le suis , invités à participer à des conférences , certaines d' entre elles étant organisées par des présidents en exercice , pleines d' experts rationnels de haut rang qui réclament une contribution européenne à des problèmes internationaux qui ne peuvent être résolus de façon adéquate au niveau local ou national .
('tackle', 'problem')	('tackle', 'problem')	[('tackle', 'traiter'), ('problem', 'problème')]	EU Governments agreed to create a common area of justice to tackle the common problem of organised crime , especially drug smuggling and human trafficking .	À côté d' autres mesures , les gouvernements de l' UE se sont également accordés sur la création d' un espace commun de justice pour traiter le problème du crime organisé , en particulier le trafic de drogue et la traite des êtres humains .
('tackle', 'problem')	('tackle', 'problems')	[('tackle', 'résoudre'), ('problems', 'problèmes')]	I would only propose a European private company statute if the impact assessment clearly shows that this is the most appropriate instrument to tackle the problems SMEs face today and that the European private company form would be useful to them in expanding their activities and developing their businesses across borders .	Je ne proposerais un statut de la société privée européenne que si l' évaluation des incidences démontre clairement qu' il s' agit de l' instrument le plus à même de résoudre les problèmes auxquels sont aujourd'hui confrontées les PME et que la forme de société privée européenne leur serait utile dans le cadre de l' expansion de leurs activités et du développement de leurs entreprises au-delà des frontières .
('tackle', 'problem')	('tackle', 'problem')	[('tackle', 'nous'), ('tackle', 'attaquer'), ('tackle', 'au'), ('problem', 'problème')]	We have to tackle both : the problem that was the European Year of Tourism and the systems that are quite inadequate in the Commission - witness the inadequacy with which the report of the Court of Auditors was dealt with .	Nous devons nous attaquer aussi bien au problème qu' a été l' Année européenne du tourisme qu' aux systèmes qui sont plutôt inadéquats au sein de la Commission - dont témoigne la médiocrité avec laquelle le rapport de la Cour des comptes a été traité .
('tackle', 'problem')	('tackle', 'problems')	"[('tackle', ""s'""), ('tackle', 'attaquer'), ('tackle', 'aux'), ('problems', 'problèmes')]"	If the terrible events of 22 December jolt those in a position of responsibility to take the actions required , not only to resolve the conflict , but also to tackle the underlying problems of poverty , deprivation and discrimination which lie behind the Zapatista revolt , the victims of Acteal will not have died in vain .	Si les terribles événements du 22 décembre déclenchent du côté des responsables politiques la volonté d' entreprendre des actions adéquates , non seulement pour résoudre le conflit , mais aussi pour s' attaquer aux problèmes sous-jacents de la pauvreté , des privations et de la discrimination qui alimentent la révolte zapatiste , les victimes d' Acteal ne seront pas mortes en vain .
('tackle', 'problem')	('tackle', 'problem')	[('tackle', 'être'), ('tackle', 'résolu'), ('problem', 'problème')]	I have made my view clear in this Parliament that I believe the only way to tackle this serious problem , which faces us all , is at national level , and closer to the people .	Je pense avoir été clair à ce sujet en disant , devant ce Parlement , que , selon moi , ce n' est qu' au niveau national que ce problème peut être résolu , à un niveau plus proche des citoyens .
('tackle', 'problem')	('tackle', 'problems')	"[('tackle', ""s'""), ('tackle', 'occupent'),  ('problems', 'problèmes')]"	Let them also tackle the problems of banking secrecy and tax havens which provide cover for money laundering .	Qu' ils s' occupent aussi des problèmes du secret bancaire et des paradis fiscaux qui offrent une couverture au blanchiment d' argent .
('tackle', 'problem')	('tackled', 'problem')	"[('problem', 'problème'), ('must', ""s'""), ('be', 'y'), ('tackled', 'attaquer')]"	Child obesity is a serious problem in Ireland and in Europe and this problem must be effectively tackled head-on .	L' obésité infantile est un grave problème en Irlande et en Europe et il est indispensable de s' y attaquer de front et de manière efficace .
('tackle', 'problem')	('tackle', 'problem')	[('tackle', 'résoudre'), ('problem', 'problème')]	We have to tackle the problem of space debris .	Nous devons tenter de résoudre le problème des débris spatiaux .
('tackle', 'problem')	('tackle', 'problems')	[('tackle', 'résoudre'), ('problems', 'problèmes')]	It is important that any new legislation in this area is based on sound evidence , not least to ensure that any future law brings forward specific and focused measures to tackle the problems .	Il est essentiel que tout nouvel acte législatif dans ce domaine se fonde sur des preuves solides , notamment pour s' assurer que tout futur acte législatif propose des mesures particulières et ciblées permettant de résoudre les problèmes .
