pair	inflected_pair	alignments	Source Language	Target Language
('attack', 'problem')	('attacking', 'problem')	[('attacking', 'attaquer'), ('problem', 'problème')]	However , I still believe that the Commission must continue to exploit various ways of attacking this problem , especially through programmes that target not only developing countries , but also certain vulnerable groups and our own Member States , because here too in our European Union , which should really set the world an example as far as the protection of human rights and the rights of women are concerned , there are still problems .	Je crois , toutefois , que la Commission doit continuer à exploiter diverses voies pour attaquer ce problème , notamment par des programmes qui soient non seulement axés sur les pays en voie de développement , mais aussi sur certains groupes vulnérables et sur nos propres pays membres , parce que chez nous aussi , dans notre Union européenne , qui devrait quand même être un exemple dans le monde pour la protection des droits de l' homme et des femmes , il y a encore des problèmes .
('attack', 'problem')	('attack', 'problems')	[('attack', 'traiter'), ('problems', 'problèmes')]	It is a positive report , supported unanimously in the Committee on Budgetary Control , and I hope the Commission will acknowledge it for what it is - a sensible approach to working jointly to attack the twin problems we have to face .	Il s' agit d' un rapport positif , qui a bénéficié du soutien unanime de la commission du contrôle budgétaire , et j' espère que la Commission l' acceptera pour ce qu' il est - une façon sensée d' envisager notre travail en commun pour traiter les problèmes semblables auxquels nous sommes confrontés .
('attack', 'problem')	('attacking', 'problem')	"[('attacking', 'en'),('attacking', ""s'""), ('attacking', 'en'), ('attacking', 'prenant'),('attacking', 'aux'), ('problem', 'problèmes')]"	By attacking them rather than the problem , the leaders of the groups have missed an opportunity today .	En s' en prenant à ce groupe plutôt qu' aux problèmes , les dirigeants des groupes ont manqué une belle occasion .
('attack', 'problem')	('attacking', 'problem')	"[('attacking', ""s'""), ('attacking', 'attaquer'), ('attacking', 'au'), ('problem', 'problème')]"	Moreover , as poverty and lack of local opportunities are amongst the main reasons for children being trafficked , the poverty-reduction approach of our development cooperation is a meaningful basis for attacking the problem .	De plus , comme la pauvreté et l' absence d' opportunités locales sont parmi les principales causes du trafic d' enfants , l' approche visant à réduire la pauvreté de notre coopération au développement constitue une excellente base pour s' attaquer au problème .
('attack', 'problem')	('attack', 'problem')	[('attack', 'aborder'),('problem', 'problème')]	You can not even begin to attack the problem .	Il eût été impossible d' aborder le problème .
('boost', 'economy')	('boosts', 'economy')	[('boosts', 'encourage'), ('economy', 'économie')]	Let us rather work together for an outcome that boosts the world 's economy , generates political confidence and helps the world 's poor .	Collaborons plutôt afin d' obtenir un résultat qui encourage l' économie mondiale , crée une confiance politique et aide les démunis de ce monde .
('boost', 'economy')	('boost', 'economies')	[('boost', 'stimuler'), ('economies', 'économies')]	I would be more than happy to continue this dialogue and to provide more information about how we approach this , because I agree completely with the view that we have to support our industries through this economic recession , be mindful of the poverty and deprivation that can occur , and give new trading opportunities that will actually help boost those economies and those sectors .	Je serais très heureuse de pouvoir poursuivre ce dialogue et de vous donner davantage d' informations sur notre approche , car je conviens tout à fait qu' il est nécessaire de soutenir nos industries pour les aider à franchir le cap de cette récession économique , d' être attentifs aux situations de pauvreté et de nécessité qui peuvent naître et d' ouvrir de nouvelles perspectives commerciales qui permettront réellement de stimuler les économies et les secteurs en difficulté .
('boost', 'economy')	('boosted', 'economy')	[('economy', 'economy'), ('should', 'doit'), ('be', 'être'), ('boosted', 'dynamisé')]	Member of the Commission . - ( CS ) Madam President , ladies and gentlemen , the Commission agrees entirely with the honourable Member that the silver economy is a very promising area of development and should be boosted at local , national and European levels .	membre de la Commission . - ( CS ) Madame la Présidente , Mesdames et Messieurs , la Commission partage entièrement l' avis du député selon lequel la silver economy est un domaine de développement très prometteur , qui doit être dynamisé aux niveaux local , national et européen .
('boost', 'economy')	('boost', 'economy')	[('boost', 'relancer'), ('economy', 'économie')]	The European Union is rightly extending export opportunities for Russian companies in EU markets to boost the Russian economy .	L' Union européenne étend à fort juste titre les possibilités d' exportation en faveur des entreprises russes sur les marchés communautaires afin de relancer l' économie russe .
('boost', 'economy')	('boosts', 'economy')	[('boosts', 'accroissent'), ('boosts', 'significativement'), ('economy', 'économie')]	Put simply , increased trade boosts a nation 's economy , raising its GDP .	Pour simplifier , davantage d' échanges commerciaux accroissent significativement l' économie d' une nation , par l' augmentation de son PIB .
('boost', 'economy')	('boost', 'economies')	[('boost', 'stimuler'),('economies', 'économies')]	This actually reduces the import of labour , and also immediately pumps in money to people who are likely to spend their money in rural areas and therefore boost rural economies .	En effet , cette formule offre l' avantage de réduire l' importation de main- d' ? uvre et d' augmenter directement le pouvoir d' achat des citoyens , lesquels pourraient dépenser leur argent dans les régions rurales et , partant , stimuler les économies rurales .
('boost', 'economy')	('boosting', 'economy')	[('boosting', 'relancer'), ('economy', 'économie')]	It has instead resulted in steady progress in terms of democracy and in your commitment , and the commitment of your country , to developing good neighbourly relations , respecting the rule of law , boosting the economy through trade and cooperation and working through the Ohrid Framework Agreement over time .	Au contraire , elle a débouché sur une progression constante de la démocratie et de votre engagement ( et de celui de votre pays ) à développer de bonnes relations de voisinage , à respecter l' État de droit , à relancer l' économie par le biais du commerce et de la coopération et à travailler conformément à l' accord-cadre d' Ohrid au fil du temps .
('boost', 'economy')	('boost', 'economies')	[('boost', 'favoriser'), ('economies', 'économies')]	While national governments implement drastic cuts , in some cases , with a short-term vision , the EU budget can provide stability and long-term planning to help - through funds such as the structural funds and cohesion funds - create jobs , provide job training and boost European economies through the recovery , particularly by providing structural funds to deprived areas hit the hardest .	Tandis que des gouvernements nationaux procèdent à des réductions drastiques avec , dans certains cas , une vision à court terme , le budget de l' UE peut offrir une stabilité et une planification à long terme , contribuant ainsi - par l' intermédiaire de fonds tels que les fonds structurels et les fonds de cohésion - à créer des emplois , proposer des formations professionnelles et favoriser les économies européennes grâce à la reprise , notamment en fournissant des fonds aux régions défavorisées les plus durement touchées .
('boost', 'economy')	('boost', 'economy')	[('boost', 'stimuler'), ('economy', 'économie')]	At the summit we agreed to make more concrete progress in a series of key areas : boosting research and development with the creation of a European research council ; improving our universities and their links with business ; creating a more competitive energy market ; examining how migration can boost our economy ; how we can use more extensive and better quality child care to give people a fairer balance between work and family life ; how we can re-skill workers to meet the global challenge , and how we can strengthen Europe 's place in the world and our collective security .	Lors du sommet , nous avons convenu de faire des progrès plus concrets dans une série de domaines clés : encourager la recherche et le développement par la création d' un Conseil européen de la recherche , améliorer nos universités et leurs liens avec les entreprises , créer un marché de l' énergie plus compétitif , examiner la manière dont la migration peut stimuler notre économie , la manière dont nous pouvons utiliser des services de garde d' enfants plus complets et de meilleure qualité afin de permettre aux citoyens de parvenir à mieux concilier vie professionnelle et vie familiale , la manière dont nous pouvons recycler les travailleurs afin de relever le défi mondial , ainsi que la manière dont nous pouvons renforcer la position de l' Europe sur la scène internationale et notre sécurité collective .
('boost', 'economy')	('boosting', 'economies')	[('boosting', 'stimuler'), ('economies', 'économies')]	Small local cottage industries have great scope for boosting local economies .	Les industries artisanales locales ont de grandes possibilités de stimuler les économies locales .
('boost', 'economy')	('boost', 'economy')	[('boost', 'relance'), ('boost', 'de'), ('economy', 'économie')]	Secondly , I want to turn to something that the Irish Prime Minister , Mr Bruton , said about the role of government in trying to create jobs and boost the economy .	Ensuite , je voudrais revenir sur les propos tenus par le premier ministre irlandais , M. Bruton , au sujet du rôle du gouvernement dans la génération d' emplois et la relance de l' économie .
('boost', 'economy')	('boost', 'economy')	[('boost', 'favoriser'), ('economy', 'économique')]	The UK has shown how free labour markets , coupled with proper social protection , can boost a prosperous economy .	Le Royaume-Uni a montré comment un marché du travail ouvert , allié à une protection sociale adaptée , peut favoriser la prospérité économique .
('boost', 'economy')	('boost', 'economies')	[('boost', 'dynamiser'), ('economies', 'économies')]	Targeted EU spending is one way in which we can boost local economies and bring jobs to our communities .	Cibler les dépenses européennes nous paraît le moyen de dynamiser les économies locales et de créer des emplois pour nos communautés .
('boost', 'economy')	('boosting', 'economy')	[('boosting', 'relancer'), ('economy', 'économie')]	Mr President , the European Heritage Label is , without doubt , a very important project , for at least two reasons : firstly , it enables European citizens to feel closer to their common and diverse history and heritage ; secondly it is a good tool for promoting cultural tourism and boosting the economy .	Monsieur le Président , le label du patrimoine européen est à n' en pas douter un projet très important pour deux raisons au moins : premièrement , il permet aux citoyens européens de se sentir plus proches de leur histoire et de leur patrimoine communs quoique différents ; ensuite , ce projet constitue un bon moyen de promouvoir le tourisme culturel et de relancer l' économie .
('boost', 'economy')	('boost', 'economy')	[('boost', 'donnent'), ('boost', 'du'), ('boost', 'tonus'), ('boost', 'à'), ('economy', 'économie')]	We need to protect these industries which create jobs and boost our economy - not just locally , but in the European domain .	Nous devons protéger ces industries qui créent des emplois et donnent du tonus à notre économie - non seulement dans le domaine local mais aussi européen .
('break', 'agreement')	('breaking', 'agreements')	[('breaking', 'déroger'), ('breaking', 'à'),('agreements', 'engagements')]	There is no case for breaking these agreements .	Il n' est pas question de déroger à ces engagements .
('break', 'agreement')	('break', 'agreement')	[('break', 'rupture'), ('break', 'de'), ('Agreement', 'accord')]	Right now , if we break the Interinstitutional Agreement , we go back to the Treaty , which gives Parliament a lot more power and a lot more authority .	À présent , en cas de rupture de l' accord interinstitutionnel , nous en revenons au Traité , qui confère au Parlement bien davantage de pouvoir et d' autorité .
('break', 'contract')	('broken', 'contract')	[('contract', 'contrat'), ('could', 'pouvait'), ('be', 'être'), ('broken', 'cassé')]	Because the contract had been signed by the previous Conservative Government , Mr Cook claimed it could not be broken .	Le contrat ayant été signé par le gouvernement conservateur précédent , M. Cook a déclaré qu' il ne pouvait pas être cassé .
('break', 'cycle')	('break', 'cycle')	[('will', 'brisera'), ('break', 'brisera'), ('cycle', 'cycle')]	On the economic side , the macro-economic framework presented in New York must be more rigorous and combined with a clear path towards employment and growth , which will break the cycle of poverty and inequality .	Sur le plan économique , le cadre macroéconomique présenté à New York doit être plus rigoureux et combiné à une orientation claire vers l' emploi et la croissance , qui brisera le cycle de la pauvreté et de l' inégalité .
('break', 'cycle')	('break', 'cycle')	[('break', 'briser'), ('cycle', 'cercle')]	We can break this vicious cycle by acknowledging that non-paid work is work indeed , by encouraging women to work and gain their economic independence , by attacking the structural causes of labour market segregation , and by paying attention to women 's problems when reforming our pension schemes .	Nous pouvons briser ce cercle vicieux en reconnaissant la légitimité du travail non rémunéré , en encourageant les femmes à travailler et à affirmer leur indépendance sur le plan économique , en nous attaquant aux causes structurelles de la ségrégation sur le marché du travail et en tenant compte de la situation des femmes dans le cadre de la réforme des régimes de retraite .
('breathe', 'life')	('breathing', 'life')	[('are', 'sommes'), ('are', 'en'), ('are', 'train'), ('are', 'de'), ('breathing', 'redonner'), ('life', 'vie')]	We are breathing new life into the Western European Union , which should have actually been defunct last year .	Or , nous sommes en train de redonner vie à l' Union de l' Europe occidentale , qui aurait dû rendre son dernier souffle l' an dernier .
('breathe', 'life')	('breathe', 'life')	[('breathe', 'insuffler'), ('life', 'vie')]	So we are pleased to have been able to breathe a little more life into this body .	Nous sommes donc satisfaits d' avoir pu insuffler un peu plus de vie dans cet organe .
('breathe', 'life')	('breathe', 'life')	[('breathe', 'insuffler'), ('life', 'vie')]	We need to breathe new life into the round .	Nous devons insuffler une nouvelle vie au cycle .
('breathe', 'life')	('breathe', 'life')	[('breathe', 'redonner'), ('life', 'vie')]	If Pörtschach can breathe new life into the vision of a united Europe by pointing the way forward on these three concepts - peace , prosperity and security - then it will be setting a new and relevant agenda for the coming years .	Si Pörtschach peut redonner vie à la vision d' une Europe unie en montrant le chemin vers ses trois concepts - paix , prospérité et sécurité - , elle fixera alors un calendrier à la fois nouveau et pertinent pour les années à venir .
('breathe', 'life')	('breathe', 'life')	[('breathe', 'insuffler'), ('life', 'vie')]	It would be easier for us to do that if we had some serious indications that Israel is really willing to breathe new life into the peace process .	Ce serait plus facile pour nous si nous disposions de quelque indication sérieuse de la véritable intention d' Israël d' insuffler une nouvelle vie dans le processus de paix .
('cast', 'doubt')	('casts', 'doubt')	[('casts', 'jettent'), ('doubt', 'doutes')]	Fresh information has come to light since the hearing in The Sunday Times this weekend which casts further doubt on whether Mr Busquin was truthful in his answers to Parliament .	Après cette audition , le Sunday Times a publié un article ce week-end qui jettent davantage de doutes sur la véracité des réponses de M. Busquin au Parlement .
('cast', 'doubt')	('cast', 'doubt')	[('cast', 'a'), ('cast', 'émis'), ('doubt', 'doutes')]	In the UK the previous Tory government cast a great deal of doubt on whether or not the euro would actually happen .	Au Royaume-Uni , le précédent gouvernement conservateur a émis de sérieux doutes sur l' avènement ou non de l' euro .
('close', 'case')	('closed', 'case')	[('case', 'affaire'), ('is', 'est'), ('closed', 'classée')]	The case is not closed .	L' affaire n' est pas classée .
('close', 'case')	('close', 'case')	[('close', 'clôture'), ('case', 'affaire')]	When a friendly solution is not possible , I close the case with a critical remark or make a draft recommendation .	Lorsqu'une solution à l' amiable n' est pas possible , je clôture l' affaire avec une remarque critique ou propose un projet de recommandation .
('close', 'case')	('closed', 'case')	[('case', 'affaire'), ('closed', 'clôturée')]	A case currently investigated by OLAF and closed in the last quarter of 2003 , involving external aid , is in judicial follow-up in Germany .	Une affaire concernant des aides extérieures , clôturée au dernier trimestre de 2003 et sur laquelle l' OLAF enquête actuellement , fait l' objet d' un suivi judiciaire en Allemagne .
('close', 'case')	('close', 'case')	[('close', 'clore'), ('case', 'dossier')]	We decided we are happy with what the French authorities gave us , but we can not close the case , because these promises , these elements of law , these proposed laws , are not yet implemented .	Nous avons décidé que nous étions satisfaits de la contribution française , mais nous ne pouvons pas clore le dossier , parce que ces promesses , ces éléments de droit , ces propositions de loi , n' ont pas encore été mis en œuvre .
('close', 'debate')	('close', 'debate')	[('close', 'vais'), ('close', 'clore'), ('debate', 'débat')]	Mr President , as spokesman for the Group of the European People 's Party , I would like to close this debate by saying , on behalf of my group , that we are going to support the report by Mr Barros Moura .	Monsieur le Président , en tant que porte-parole du groupe du parti populaire européen , je vais clore ce débat au nom de mon groupe en disant que nous allons appuyer le rapport de M. Barros Moura .
('close', 'debate')	('close', 'debate')	[('close', 'clore'), ('debate', 'débat')]	We welcome this but we would also like to ask that Members have the possibility of putting down motions for a resolution to close the debate .	Cependant , nous voudrions également demander que les députés aient la possibilité de déposer des propositions de résolution pour clore le débat .
('close', 'debate')	('close', 'debate')	[('close', 'NULL'), ('debate', 'NULL')]	Pursuant to Rule 37 of the Rules of Procedure , I have received six motions for resolution to close the present debate .	J' ai reçu , sur la base de l' article 37 du règlement , six propositions de résolution .
('close', 'debate')	('close', 'debate')	[('close', 'conclure'), ('debate', 'débat')]	I would like to remind you that the Raimon Obiols i Germà and Charles Tannock report will be put to the vote tomorrow morning , and that the texts submitted to close the debate on the Council and Commission statements will be put to the vote in Brussels on 29 November 2007 .	J' aimerais vous rappeler que le rapport Raimon Obiols i Germà et Charles Tannock sera soumis au vote demain matin , et que les textes présentés pour conclure le débat sur les déclarations du Conseil et de la Commission seront soumis au vote a Bruxelles le 29 novembre 2007 .
('close', 'debate')	('close', 'debate')	[('close', 'est'), ('close', 'clos'),  ('debate', 'débat')]	After this speech by the Commissioner , to whom we wish the best of luck , secure in the knowledge that he will do an excellent job , as he has done in the past , we close the debate .	Après cette intervention du commissaire , à qui nous souhaitons bonne chance , dans la certitude qu' il fera un excellent travail , comme il l' a fait dans le passé , le débat est clos .
('close', 'debate')	('closed', 'debate')	[('closed', 'ai'), ('closed', 'clos'), ('debate', 'débat')]	Mrs Kinnock , the Commission did not ask to reply on the last item and that is why I closed the debate , precisely because there was no request to speak .	Madame Kinnock , la Commission n' a pas demandé de répondre sur le point précédent et c' est la raison pour laquelle j' ai clos le débat .
('close', 'debate')	('close', 'debate')	[('close', 'clore'), ('debate', 'débat')]	Miss Lynne would have asked that we be allowed to close the debate on the question of British beef with motions for a resolution from the various political groups .	Mme Lynne aurait demandé de clore le débat sur la viande bovine britannique par des propositions de résolution émanant de divers groupes politiques .
('close', 'debate')	('close', 'debate')	[('to', 'en'), ('close', 'conclusion'), ('close', 'du'), ('debate', 'débat')]	I would like to make that proposal that the political groups be invited to submit motions for a resolution to close the debate on British beef .	Je voudrais proposer que les groupes politiques soient invités à introduire des propositions de résolution en conclusion du débat sur la viande bovine britannique .
('close', 'debate')	('close', 'debate')	[('am', 'clôturer'), ('going', 'clôturer'), ('to', 'clôturer'), ('close', 'clôturer'), ('debate', 'débat')]	I am going to close the debate .	Le moment est venu pour moi de clôturer le débat .
('close', 'debate')	('closing', 'debate')	[('closing', 'clore'), ('debate', 'débat')]	Thank you , Mrs Green , but I have no way of closing this debate today while people are still asking for the floor .	Merci , madame Green , mais aujourd'hui par contre je n' ai aucune possibilité de clore ce débat tant qu' il y a des demandes de parole .
('close', 'debate')	('closed', 'debate')	[('debate', 'débat'), ('to', 'clôture'), ('be', 'clôture'), ('closed', 'clôture'), ('closed', 'de')]	Madam President , I would simply like to point out that on Wednesday , on the initiative of the President , we voted for an adjournment of the urgent debate on Zaire , but not for the debate to be closed .	Madame le Président , je voulais simplement signaler que nous avions voté mercredi , à l' initiative de la présidence , en faveur d' une interruption du débat d' urgence sur le Zaïre , mais non en faveur d' une clôture de ce débat .
('close', 'project')	('closed', 'project')	[('project', 'projet'), ('had', 'a'), ('been', 'été'), ('closed', 'clôturé'), ('down', 'clôturé')]	What I have been hearing about the representative in Nicaragua is indicative that the project had not been properly closed down .	Ce que j' ai entendu au sujet du représentant au Nicaragua indique que le projet n' a pas été correctement clôturé .
('colour', 'judgement')	('colouring', 'judgement')	[('colouring', 'faussent'), ('judgement', 'jugement')]	We should see this Commission as a college and while the individual commissioners must be held accountable , nevertheless we must take an objective view of what is going on and beware of either European party politics or international politics colouring our judgement .	Nous devrions considérer cette Commission comme un collège et , alors que les commissaires individuels doivent être tenus pour responsables , nous devons toutefois apprécier objectivement la situation et veiller à ce que des politiques de partis européens ou des politiques internationales ne faussent notre jugement .
('digest', 'content')	('digest', 'contents')	[('digest', 'digérer'), ('contents', 'contenu')]	However , you may not all have had time to digest their contents and I will , therefore , briefly summarise the main issues .	Néanmoins , il se peut que vous n' ayez pas eu le temps d' en digérer le contenu , c' est pourquoi je résumerai brièvement les principaux points .
('find', 'excuse')	('finding', 'excuse')	[('finding', 'en'), ('finding', 'trouvant'), ('excuse', 'excuse')]	Can we really restore trust and generate inspiration among the voters if we continue to conduct our policies from one national election to another , finding in them a good excuse not to apply the common policies ?	Pouvons -nous réellement rétablir la confiance et susciter l' enthousiasme parmi les électeurs si nous continuons de mener nos politiques d' une élection nationale à l' autre , en trouvant dans celles-ci une bonne excuse pour ne pas appliquer les politiques communes ?
('find', 'excuse')	('found', 'excuse')	[('excuse', 'excuses'), ('have', 'avoir'), ('found', 'trouvé')]	It does not matter who you are or what excuse you think you have found for your perverse and nihilistic , violent ideology .	Peu importe qui tu es ou quelles excuses tu penses avoir trouvé pour ton idéologie perverse , nihiliste et violente .
